filename,text,word_count,tools,tool_number
Entretien 01 25.04.10_traitement_A,"Le routoir c'est une espèce de petite piscine d'eau qui fait qu'au printemps, les brins d'osier repartent, en sève, et on peut plus facilement enlever l’écorce.",26,,0
Entretien 01 25.04.10_traitement_A,Ça s'appelle le pelage.,4,,0
Entretien 01 25.04.10_traitement_A,"Et donc là on va avoir un osier blanc, qu'on va faire sécher.",13,,0
Entretien 01 25.04.10_traitement_A,"Vous voyez, il a déjà eu une grande vie l'osier.",10,,0
Entretien 01 25.04.10_traitement_A,"Après, nous quand on a besoin d'un panier, on sait les tailles, on estime les tailles dont on a besoin, donc on va dans la réserve, on choisit un brin d'osier, on trie nos brins d'osier, et on le remet à tremper, pour qu'il reprenne un peu de souplesse avec l'eau.",51,,0
Entretien 01 25.04.10_traitement_A,"Donc il passe par beaucoup d'étapes, ce brin vivant, sec, re-humidifié, et après là on travaille, et là il va être tordu, plié, tourné, cordelé, donc il peut subir vraiment tous les outrages (?) pour nous donner toute sa mesure.",40,,0
Entretien 01 25.04.10_traitement_A,C'est assez magique.,3,,0
Entretien 01 25.04.10_traitement_A,"Bon, des fois il casse, souvent même, peut-être parce qu'on ne l'a pas fait assez tremper, ou alors il a attendu trop longtemps qu'on l'utilise, il a resséché un peu, parce que le virage est trop serré, parce qu'il y a beaucoup de choses qui peuvent...",46,,0
Entretien 01 25.04.10_traitement_A,"Au début on le coude aussi beaucoup, au lieu de faire des bons arrondis, on les coude, parce qu'on n'a pas la finesse du doigté, c'est quelque chose qui s'apprend au fur et à mesure.",35,,0
Entretien 01 25.04.10_traitement_A,Je ne sais pas quoi d'autre vous dire.,8,,0
Entretien 01 25.04.10_traitement_A,"Oui, absolument.",2,,0
Entretien 01 25.04.10_traitement_A,Et là je peux même vous dire qu'on est sur un projet et qu'on doit partir d'un objet traditionnel et faire un autre objet.,24,,0
Entretien 01 25.04.10_traitement_A,Et là moi j'ai pris un vieux banneton de mon grand-père qui était boulanger.,14,,0
Entretien 01 25.04.10_traitement_A,"Mon grand-père est né en 1800, et des cacahuètes.",9,,0
Entretien 01 25.04.10_traitement_A,"Et c'est un banneton qui a minimum 80 ans, il est toujours là.",13,,0
Entretien 01 25.04.10_traitement_A,"Il est abîmé, je le concède, mais il est toujours là.",11,,0
Entretien 01 25.04.10_traitement_A,"Donc c'est un matériau qui a priori est fragile, mais en fait, quand je vois le banneton de mon grand-père, je me dis qu'il en a vu des trucs ce banneton, y compris la guerre.",35,,0
Entretien 01 25.04.10_traitement_A,Je vous en prie.,4,,0
Entretien 01 25.04.16 01_traitement_A,Comment on dit ?,4,,0
Entretien 01 25.04.16 01_traitement_A,"Déjà c'est le mot artisan, je l'utilise jamais.",8,,0
Entretien 01 25.04.16 01_traitement_A,Depuis 1997.,2,,0
Entretien 01 25.04.16 01_traitement_A,Techniquement ?,2,,0
Entretien 01 25.04.16 01_traitement_A,"Ouf, le problème c'est que moi j'ai un petit peu particulier par rapport à le verrier.",16,,0
Entretien 01 25.04.16 01_traitement_A,Il y a beaucoup de verriers normalement qui ont leur propre spécialité.,12,,0
Entretien 01 25.04.16 01_traitement_A,"Moi je touche un petit peu tout, j'ai un petit peu autonome, un petit peu tous les techniques.",18,,0
Entretien 01 25.04.16 01_traitement_A,"Donc tout dépend des conditions, par exemple le concept, j'apprends ces techniques, je réalise avec ça.",16,,0
Entretien 01 25.04.16 01_traitement_A,"Donc je sais parfaitement, par exemple le soufflage, pâte verre, le fusing, thermoformage, même par exemple un petit parti de chalumeau, je suis assez autonome.",25,,0
Entretien 01 25.04.16 01_traitement_A,"La canne aussi, oui.",4,,0
Entretien 01 25.04.16 01_traitement_A,"Le problème oui, parce que je ne peux pas, par exemple, j'adore apprendre, j'aime bien souffler, par exemple je sais souffler, par exemple mon style de travail en tant qu'BIP, le gros pied, tout ça il n'y a pas de problème, mais je ne sais pas faire le verre à pied.",51,,0
Entretien 01 25.04.16 01_traitement_A,"Donc je n'ai jamais appris, encore un jour si j'ai un projet par rapport à ça, pourquoi pas, mais ça ne m'intéresse pas.",23,,0
Entretien 01 25.04.16 01_traitement_A,Avec le verre… Comment c'est expliqué là ?,8,,0
Entretien 01 25.04.16 01_traitement_A,"C'est un petit peu dur parce que moi je n'ai pas une routine en tant que verrier, donc pour ça c'est difficile.",22,,0
Entretien 01 25.04.16 01_traitement_A,"Si il y a un projet, il y a un concept, j'ai fait beaucoup de recherches conceptuellement, dans la théorie, tout ça par l'ordinateur.",24,,0
Entretien 01 25.04.16 01_traitement_A,"Dans ça normalement je trouve la forme, ça peut être un soufflage, ça peut être un pâte de verre, si c'est ça comment c'est un pâte de verre, je commence à préparer ma forme, je ne sais pas quoi dire.",40,,0
Entretien 01 25.04.16 01_traitement_A,"Ce n'est pas informatiquement, par exemple, la dernière pièce que je suis en train de faire, j'aime bien travailler par rapport à l'actualité du monde entier, donc par rapport à l'histoire de la société, là c'est par exemple le dernier sujet que je suis en train de faire par rapport à la frontière, une frontière qui a un problème entre les deux pays, donc je récolte de toutes les frontières qui ont un problème, par exemple l'Inde avec le Pakistan, ou l'Israël, tout ça, ou soit c'est aux Etats-Unis avec le Mexique, même par exemple moi qui en tant que BIP, BIP et BIP, il y a une frontière quand même, j'aime bien ces sortes de frontières, ce n'est pas lisible, on ne le voit pas, mais quand même on vit avec, donc ce genre de possibilités j'ai envie de donner sous le verre, donc j'ai en train de préparer par exemple, sous le plaque en verre, j'ai dessiné avec le fil de cuivre, non, peinture de cuivre on dit, j'ai fait un sorte de flashage, tu connais le flashage ?",181,,0
Entretien 01 25.04.16 01_traitement_A,"Non, ce n'est pas sérigraphie, c'est un flashage, c'est une sorte d'électronique, électricité, donc si je vais mettre une plaque de verre, je vais peindre une sorte de conducteur, donc c'est une peinture au cuivre qui donne un conducteur, je plonge dans le bain l'acide, je vais mettre plus ou moins une sorte d'électricité avec une quantité de cuivre ailleurs, normalement cette quantité de cuivre qui va déménager sur le verre.",71,,0
Entretien 01 25.04.16 01_traitement_A,"Voilà, c'est un petit peu comme ça.",7,,0
Entretien 01 25.04.16 01_traitement_A,Donc c'est une force d'énergie qui le dessine sur le verre.,11,,0
Entretien 01 25.04.16 01_traitement_A,"Donc ce genre de chose, là je viens de finir, mais quand même il y a un long flashage par plaque, normalement c'est au moins 3 ou 4 semaines, donc chaque jour, vérification, nettoyage, vérification, nettoyage, voilà.",37,,0
Entretien 01 25.04.16 01_traitement_A,Ah !,2,,0
Entretien 01 25.04.16 01_traitement_A,Moulage.,1,,0
Entretien 01 25.04.16 01_traitement_A,"On peut dire ça, c'est un geste, c'est pas un geste, c'est un technique, mais voilà, donc c'est un moulage, je pense un point fort de mon côté, parce que c'est le pâte-verre, c'était quand même, voilà, casting et pâte-verre, c'était mon point fort.",44,,0
Entretien 01 25.04.16 01_traitement_A,"Je parlerai peut-être l'autre moulage, parce que c'est, pour ma part, il y a deux moulages dans mon travail, il y a deux façons de moulage qui sont différentes.",29,,0
Entretien 01 25.04.16 01_traitement_A,"Premièrement, normalement, c'est pas comme d'habitude, comme les autres, parce que c'est un moment où je travaillais par rapport à BIP.",21,,0
Entretien 01 25.04.16 01_traitement_A,"Voilà, donc j'aime bien travailler par rapport à ça, mais je travaille jamais avec le cristal, avec le verre transparent.",20,,0
Entretien 01 25.04.16 01_traitement_A,"J'aime bien travailler avec le verre à vitre, parce que le verre à vitre, normalement, il y a une couleur qui est assez, un couleur vert, bleu-vert, qui est naturellement, ce n'est pas naturellement, c'est fabrication, normalement, qui était déjà teintée.",41,,0
Entretien 01 25.04.16 01_traitement_A,"Donc j'aime bien, pour utiliser cette couleur, après le cuisson.",10,,0
Entretien 01 25.04.16 01_traitement_A,"Donc, normalement, c'est un premier, normalement, je découpe, donc ce n'est pas un autre moulage, une autre façon de moulage.",20,,0
Entretien 01 25.04.16 01_traitement_A,"Par rapport à mon dessin, je découpe le verre à vitre, je vais rassembler, comme si c'était un sort de, un contenant, créer un sort de contenant avec un verre à vitre, avec plusieurs épaisseurs différentes.",36,,0
Entretien 01 25.04.16 01_traitement_A,"Après, la plupart des moulages, normalement, les gens qui utilisent le plâtre, moi je n'utilise pas le plâtre, je vais utiliser le nappe, qu'est-ce qu'on peut dire ça ?",29,,0
Entretien 01 25.04.16 01_traitement_A,"ça fait longtemps que je n'ai pas utilisé ça, donc j'ai oublié le nom, un sort de fibre humide.",19,,0
Entretien 01 25.04.16 01_traitement_A,"C'est une épaisseur qui est humide, qui prend la forme que je lui donne.",14,,0
Entretien 01 25.04.16 01_traitement_A,"Cette fibre, normalement, c'est haute température, ça tenait comme si c'était un moulage.",13,,0
Entretien 01 25.04.16 01_traitement_A,"Moi, par exemple, j'emballe mes pièces avec cette fibre humide, après, je vais extérieur, je vais attacher, parce que sinon ça s'ouvre par rapport à la force de verre qui coule, donc je vais emballer avec un fil de cuivre pour attacher extérieur.",43,,0
Entretien 01 25.04.16 01_traitement_A,"Après, je vais poser cette pièce dans le four, je vais monter jusqu'à 920.",14,,0
Entretien 01 25.04.16 01_traitement_A,C'est un cuisson à peu près une semaine.,8,,0
Entretien 01 25.04.16 01_traitement_A,"C'est une raison pour l'utiliser, le fibre, parce que le verre, une fois c'est contacté avec le plâtre, normalement, il y a une sorte de petite pellicule qui a été posée sur le verre, ça va devenir une sorte d'air un petit peu dépoli.",44,,0
Entretien 01 25.04.16 01_traitement_A,"Donc je n'aime pas cet effet, mais là, par exemple, le fibre humide, avec le contact avec le verre, normalement, c'est qu'il garde vraiment qualité de verre.",27,,0
Entretien 01 25.04.16 01_traitement_A,Donc voilà.,2,,0
Entretien 01 25.04.16 01_traitement_A,"Oui, elle va changer un petit peu, parce que normalement, c'est un plaque en verre.",15,,0
Entretien 01 25.04.16 01_traitement_A,"Après, c'est un petit peu de finesse vers le haut, parce que c'est la masse qui était coulée vers le bas qu'on garde, mais il y a une petite partie de petite pellicule qui a collé sous le verre à vitre, ah non, sous le fibre humide, comme si c'était un l’eau qui est en train de couler.",58,,0
Entretien 01 25.04.16 01_traitement_A,C'est ce genre d'effet qu'on peut avoir avec cette technique.,10,,0
Entretien 01 25.04.16 01_traitement_A,"C'est un peu un accident, parce que c'est...",8,,0
Entretien 01 25.04.16 01_traitement_A,"Le problème, parce que le verre, c'est jamais...",8,,0
Entretien 01 25.04.16 01_traitement_A,"On touche au début, c'est pour pratiquer moi-même, pour couper, pour donner la forme, mais à part tout ça, je peux assumer, à part les autres pièces, si tu peux pas assumer.",32,,0
Entretien 01 25.04.16 01_traitement_A,"Même avec le même cuisson, la même température, le même flou, c'est le verre qui réagit pas de la même façon.",21,,0
Entretien 01 25.04.16 01_traitement_A,Donc...,1,,0
Entretien 01 25.04.16 01_traitement_A,"Toujours, c'est...",2,,0
Entretien 01 25.04.16 01_traitement_A,Je comprends pas.,3,,0
Entretien 01 25.04.16 01_traitement_A,"Même par exemple, ça fait 30 ans que je travaille, mais c'est...",12,,0
Entretien 01 25.04.16 01_traitement_A,C'était bizarre.,2,,0
Entretien 01 25.04.16 01_traitement_A,"Au début, j'étais un petit peu énervée quand on commençait à travailler le verre, parce que moi, j'ai commencé avec le métal.",22,,0
Entretien 01 25.04.16 01_traitement_A,"Donc j'étais en formation de sculpteur, métal, bois, le moulage, tout ça, mais surtout avec le métal, parce que le métal, normalement, il n'y a pas d'accident.",27,,0
Entretien 01 25.04.16 01_traitement_A,"Si je veux ça, je veux ça.",7,,0
Entretien 01 25.04.16 01_traitement_A,Donc c'est...,2,,0
Entretien 01 25.04.16 01_traitement_A,"J'étais très habituée pour travailler comme un métal, mais au début, quand je travaillais avec le verre, j'étais vraiment énervée.",20,,0
Entretien 01 25.04.16 01_traitement_A,"Parce que tous les cuissons, on peut pas toucher, on peut pas regarder, tout ça, donc...",16,,0
Entretien 01 25.04.16 01_traitement_A,Voilà.,1,,0
Entretien 01 25.04.16 01_traitement_A,"Donc il faut toujours un petit peu tenir la prévention de ces pièces, à mon avis.",16,,0
Entretien 01 25.04.16 01_traitement_A,Oui.,1,,0
Entretien 01 25.04.16 01_traitement_A,Oh là là !,4,,0
Entretien 01 25.04.16 01_traitement_A,Oh !,2,,0
Entretien 01 25.04.16 01_traitement_A,Parce que...,2,,0
Entretien 01 25.04.16 01_traitement_A,"Là, c'est par exemple...",4,,0
Entretien 01 25.04.16 01_traitement_A,C'était quand même un...,4,,0
Entretien 01 25.04.16 01_traitement_A,C'était un fenêtre.,3,,0
Entretien 01 25.04.16 01_traitement_A,"C'est un moment qui était dur, et solide, c'est transparent.",10,,0
Entretien 01 25.04.16 01_traitement_A,"Normalement, c'est un fenêtre pour traverser, pour regarder ailleurs.",9,,0
Entretien 01 25.04.16 01_traitement_A,"Et en même temps, parce que c'est une sorte de seuil, c'est pour une sorte de diviser en matière qui...",20,,0
Entretien 01 25.04.16 01_traitement_A,qui divise pour extérieur-intérieur.,4,,0
Entretien 01 25.04.16 01_traitement_A,C'est une sorte de...,4,,0
Entretien 01 25.04.16 01_traitement_A,Voilà.,1,,0
Entretien 01 25.04.16 01_traitement_A,"Mais cette matière qui était emballée pour donner une forme, avec une sorte de...",14,,0
Entretien 01 25.04.16 01_traitement_A,"de température, de...",3,,0
Entretien 01 25.04.16 01_traitement_A,"de chaleur, qui est très chaude, qui a commencé à fondre, carrément, c'est...",13,,0
Entretien 01 25.04.16 01_traitement_A,"Ah, ça me donne un chaleur là !",8,,0
Entretien 01 25.04.16 01_traitement_A,"C'est une chaleur qui a transformé, qui a fait dégouliner tous les aspects durs, qui est complètement perdue.",18,,0
Entretien 01 25.04.16 01_traitement_A,"Mais ce moment-là, normalement, je ne le voyais pas en tant qu'BIP.",12,,0
Entretien 01 25.04.16 01_traitement_A,"Peut-être une matière qui va sortir dans le four, mais qui va épouser la forme qu'on lui donne.",18,,0
Entretien 01 25.04.16 01_traitement_A,"Après, cette liquidité, c'est comme si c'était un mouvement de l'eau qui prend la forme de celle de vers le bas.",21,,0
Entretien 01 25.04.16 01_traitement_A,"Après, voilà, c'est un petit côté accroche qui...",8,,0
Entretien 01 25.04.16 01_traitement_A,"qui ne va pas descendre vers le bas, qui va accrocher sur le fibre pour tenir une sorte de...",19,,0
Entretien 01 25.04.16 01_traitement_A,un moment de geste qu'on le voit après le cuisson.,10,,0
Entretien 01 25.04.16 01_traitement_A,"Donc, même, par exemple, là, c'est une haute température, en tant qu'BIP, on ne le voyait pas, mais, voilà, une fois cet effet descendu, il est complètement l'autre visage.",29,,0
Entretien 01 25.04.16 01_traitement_A,"Au début, normalement, il était transparent.",6,,0
Entretien 01 25.04.16 01_traitement_A,"L'autre côté, il n'est pas transparent du tout.",8,,0
Entretien 01 25.04.16 01_traitement_A,"Il était plusieurs morceaux, mais la fin, il était un morceau qui était dur, beaucoup plus épais.",17,,0
Entretien 01 25.04.16 01_traitement_A,"Le couleur qui était plus que transparent, qu'on le voyait dehors, là, c'est plutôt...",14,,0
Entretien 01 25.04.16 01_traitement_A,C'est comme si c'était une couleur de la mer ou de...,11,,0
Entretien 01 25.04.16 01_traitement_A,"Voilà, c'est un reflet de couleurs qui va créer après le cuisson.",12,,0
Entretien 01 25.04.16 01_traitement_A,"Voilà, donc...",2,,0
Entretien 01 25.04.16 01_traitement_A,Oui ?,2,,0
Entretien 01 25.04.16 02_traitement_A,"Alors, 98, 2000, ça fait 25 ans.",7,,0
Entretien 01 25.04.16 02_traitement_A,"J'ai commencé en 2009, BIP.",5,,0
Entretien 01 25.04.16 02_traitement_A,"Donc 2009, maintenant, 2010, 15-16 ans.",6,,0
Entretien 01 25.04.16 02_traitement_A,Et pour les ébénistes ?,5,,0
Entretien 01 25.04.16 02_traitement_A,"La même chose, parce que je suis arrivée, c'était les mêmes.",11,,0
Entretien 01 25.04.16 02_traitement_A,"Les apprentis, les BMA par exemple, on va prendre l'exemple des brevets des métiers d'art.",15,,0
Entretien 01 25.04.16 02_traitement_A,"Alors, les premières années, ce sont des élèves en général qui ont bien souvent le bac.",16,,0
Entretien 01 25.04.16 02_traitement_A,"Donc déjà, ils ont une espèce d'autonomie dans le travail.",10,,0
Entretien 01 25.04.16 02_traitement_A,"Qu'est-ce qu'on va faire, on va commencer ?",8,,0
Entretien 01 25.04.16 02_traitement_A,"Tout dépend, mais bien souvent, alors soit c'est de la culture artistique, c'est assez classique.",15,,0
Entretien 01 25.04.16 02_traitement_A,"Je vais leur montrer pas mal de choses au tableau, il y a un diaporama, on va parler d'un courant, on va parler du 19e, je vais leur montrer Haussmann, qu'est-ce qu'il a fait Haussmann, ta-da-ta-ta-ta.",36,,0
Entretien 01 25.04.16 02_traitement_A,"Je leur emmène plein de têtes, désolée, je leur emmène beaucoup de choses, je me permets, parce qu'ils ont un bon niveau quand même.",24,,0
Entretien 01 25.04.16 02_traitement_A,"Et puis, je vais leur faire une frise chronologique, donc ils vont avoir un petit papier, et puis parcours en, parcours en stylistique, je vais leur dire, alors là, c'est un peu du travail dirigé, au tableau, j'écris, parce que c'est pareil, les mots en fait ne sont pas trop à l'aise, donc je vais marquer ornement, paf, ornement, 19e, paf, paf, paf, et on va faire donc du croquis, et c'est beaucoup d'écoutes.",74,,0
Entretien 01 25.04.16 02_traitement_A,"Ça, c'est pour la culture artistique, j'en mets pas trop, parce que c'est lourd, et on perd vite leur attention.",20,,0
Entretien 01 25.04.16 02_traitement_A,"Et bien souvent, je leur mets un petit test, la séance d'après.",12,,0
Entretien 01 25.04.16 02_traitement_A,"En général, je ne me mets pas trop rapprochée, j'aime bien mettre deux styles par exemple, Louis XV ou Louis XVI, et puis on fait, je leur fais un petit test qui permet de corréler un peu les deux, de faire des petites conclusions sur finalement, qu'est-ce que, le 18e, c'est le confort, c'est les femmes qui ont apporté plein de choses, etc.",63,,0
Entretien 01 25.04.16 02_traitement_A,"et les encyclopédistes, enfin bref, culture G.",7,,0
Entretien 01 25.04.16 02_traitement_A,"En art appliqué, ça sera beaucoup, alors c'est très tradi (traditionnel), parce que finalement, moi je suis du dessin à la base, donc ça m'arrange bien.",26,,0
Entretien 01 25.04.16 02_traitement_A,"Donc on va par exemple faire une planche, on va faire des planches, on va faire plein de croquis avant, on va essayer de faire des dessins, c'est assez, voilà, des dessins très hyper réalistes, le truc c'est ça, c'est d'essayer de rendre au mieux les effets de matière, donc si c'est du bois, on va essayer de rendre un joli effet bois, donc plan de couleur aquarellable, ou feutre, feutre pro marqueur, on va essayer de bien rendre, parce que souvent, ce qu'il y a, c'est qu'ils ont des idées, et l'objectif de mon cours, c'est de les rendre compréhensibles par d'autres gens, qui n'ont pas forcément une vision dans l’espace, et compagnie, donc le dessin doit vraiment être au plus, rendre au mieux ce qu'ils ont dans la tête, donc c'est pour ça qu'on les embête avec les ombres, les lumières, le modelé, voilà, donc c'est ça qu'on va faire dans un cours classique, beaucoup de croquis, de dessins, je vais les aider, je viens les aider, alors qu'en temps normal, on n'est pas censé aider du tout, on montre, alors on fait des démonstrations, mais des fois, on les aide un petit peu, voilà, puis ensuite, on va récupérer la planche, on évalue, on le rend, etc.",210,,0
Entretien 01 25.04.16 02_traitement_A,"Oui, dans la journée, on n'aura pas avancé beaucoup, forcément, des fois, ils sont super autonomes, donc des fois, ils ont peut-être, il y en a qui va, c'est au cas par cas, vu qu'ils ont tous un thème différent, il y en a qui aura une avance pas possible, donc du coup, il faudra déjà que je prépare un travail pour après, là, par exemple, pour les terminales, on fait un dossier, donc on fait des planches qui vont dans le dossier, et c'est toute l’arme, donc du coup, il y en a qui vont faire, ben, il y en a une, d'ailleurs, c'est une élève, elle est super en avance, je suis obligée de prévoir des choses à lui donner, quoi, parce que les autres, ils sont en galère, ils sont plus lents dans l'exécution, parce qu’il ne faut pas non plus, trop, trop, les stresser, donc elle, du coup, je lui donne du boulot en plus, elle est bien, puis ils sont assez autonomes, quand même, mine de rien, puis c'est un peu une gymnastique, il y a un rituel, les planches, une fois qu'on en a fait une, ils savent très bien qu'ils doivent faire à gauche, les recherches, les ébauches, toutes les idées possibles, ça, ils n'aiment pas, mais je leur dis, ce n'est pas un produit fini et on va laisser peser, non, c'est des tas d'étapes, des choses qui sont des variantes, finalement, et ensuite, ça va être la partie, c'est dans l’entaillage, par exemple, entaillage, c'est la partie bois, métal, et bien, pourquoi ils ont pris cette forme-là, avec la photo à côté, qui se réfère à leur thème et qui est ressemblante, enfin, voilà, des petites choses comme ça.",288,,0
Entretien 01 25.04.16 02_traitement_A,"Elles doivent être un peu pédagogiques, souvent, je leur dis, les planches, il faut qu'on les comprenne, en fait, c'est comme un doctorant, comme une thèse, il faut qu'ensuite, comme un livre, on l'ouvre, on comprend bien tout ce qui est présenté.",42,,0
Entretien 01 25.04.16 02_traitement_A,"Ah, oui.",2,,0
Entretien 01 25.04.16 02_traitement_A,"Ben, ah là là, oui, j'en ai un peu plusieurs, mais j'en vois un, mais pas spécialement avec les BIP, pour le coup.",23,,0
Entretien 01 25.04.16 02_traitement_A,Ce ne sera pas vraiment avec eux.,7,,0
Entretien 01 25.04.16 02_traitement_A,Ce sera plus avec les agenceurs.,6,,0
Entretien 01 25.04.16 02_traitement_A,"Avec les agenceurs, bien souvent, on fait ça, je fais une démonstration, je leur dis, voilà, aujourd'hui, je vous fais une démo, je vais vous montrer comment, vous avez un problème d'espace, on vous demande de reconcevoir cette pièce, le salon, et c'est vrai que ça, mais ça, c'est parce que c'est moi, et moi et mon crayon, et que je dessine vite, je sais, parce qu'on me l'a fait comprendre du moins, et que c'est vite par rapport à d'autres, mais c'est lent par rapport à d'autres, enfin, ce n'est pas tellement le problème, mais c'est vrai que je vois bien que quand je dessine, et que là, je les entends dire, oh là là, oh là là, mais moi, je mets quatre heures pour faire ça, et c'est des choses comme ça, et c'est vrai que ce geste-là, l'assurance que je peux avoir quand je dessine, c'est parce qu'aussi, je dessine depuis belle lurette, et je ne dis pas que c'est sensationnel, loin de là, mais je reconnais quand je dessine une petite perspective au crayon, tout simplement, et que je passe mes éléments, je vois bien quel effet ça peut produire sur l'élève qui se dit, ah oui, ah oui, ah oui, il faut aller vite, parce qu'en fait, ces gamines, elles sont trop, je dirais trop, elles sont trop studieuses, elles prennent la règle pour tout, et je leur dis, on doit être dans l'instinct, il faut aussi que ton croquis, je leur parle tout le temps de la ligne en mourant, je leur dis, c'est une ligne en mourant, tu ne dois pas, tout colorier, on ne s'en fiche pas mal, c'est une indication, c'est ton client, tu lui dis qu'en fait, là, tu lui mets un petit sol en parquet, tu ne vas pas faire latte par latte, tu y vas, tchac, tchac, tchac, donc je leur montre mon petit croquis, je le fais en très peu de temps, c'est ça qui les épate, je leur dis, oui, mais regarde, après, je peux revenir dessus et prendre plaisir, on ne veut pas la course, mais je veux tout mettre rapidement sur ma feuille, parce que j'ai dans la tête, donc, sinon, c'est ma main et la continuité de ce que j'ai dans la tête et oui, après, je peux mettre un peu de lumière et oui, je peux donner des petits détails, alors qu'elles, elles seraient capable de faire bouteille par bouteille, vous voyez, sur une étagère, je leur dis, non, ce n'est pas, c'est ennuyeux à faire, je leur dis, en fait, il faut avoir plaisir, c'est ce que j'essaye de leur faire, mais après, est-ce qu'il y a un geste, je ne sais pas.",452,,0
Entretien 01 25.04.16 02_traitement_A,"Oui, alors ça, c'est la cuisine, et bien ça, c'est la cuisine et c'est ça que je leur dis, le truc, c'est ça, c'est, il faut avoir plein de choses autour, un crayon, des feutres, des crayons de couleurs marrons, quelques feutres gris, il n'y a pas besoin d'avoir dix mille choses et en fait, la craie blanche, le petit posca blanc, vous avez ça autour de vous et ça y est, c'est parti et ça y va tout seul, le petit feutre au fin noir et, ben ouais, c'est une espèce de cuisine, il faut qu'il y ait ça autour et on se régale, quoi.",106,,0
