filename,text,word_count,tools,tool_number
Entretien 01 24.12.16_traitement_A,"Au bout d'un moment, vous avez plein de bouts de verre dans les doigts, plein d'écharde dans les doigts.",19,,0
Entretien 01 24.12.16_traitement_A,Ça ne doit pas être évident.,6,,0
Entretien 01 24.12.16_traitement_A,Donc voilà.,2,,0
Entretien 01 24.12.16_traitement_A,Je pense que…,3,,0
Entretien 01 24.12.26_traitement_A,"Alors, moi je suis dans le métier, je suis entré en tant qu'apprenti en 89, chez un patron d'apprentissage qui faisait de la ferronnerie d'art, qui était ferronnier d'art.",29,,0
Entretien 01 24.12.26_traitement_A,Je suis resté chez lui deux ans.,7,,0
Entretien 01 24.12.26_traitement_A,"J'étais déjà chez les Compagnons, donc j'ai fait mon apprentissage chez les Compagnons et à l'époque, on était, comment dire, envoyés loin de chez nous.",25,,0
Entretien 01 24.12.26_traitement_A,"Donc, on était en journée au boulot et le soir, en fait, on était à la maison des Compagnons.",19,,0
Entretien 01 24.12.26_traitement_A,"Et donc, on passait pas mal de temps à être...",10,,0
Entretien 01 24.12.26_traitement_A,"on était immergés dans le métier, au milieu des autres corps d'État.",12,,0
Entretien 01 24.12.26_traitement_A,"Donc, j'ai toujours fait que ça.",6,,0
Entretien 01 24.12.26_traitement_A,"J'ai occupé différents postes, comme je vous le disais tout à l'heure, donc apprenti, après ouvrier, ouvrier qualifié, chef d'équipe.",20,,0
Entretien 01 24.12.26_traitement_A,"Ensuite, j'ai travaillé en tant que chef d'atelier et en bureau d'études, après, dans une autre entreprise.",17,,0
Entretien 01 24.12.26_traitement_A,"Et j'ai fait une cour aparté d'un an et demi, dans autre chose que mon métier, où je travaillais en fait en tant que...",24,,0
Entretien 01 24.12.26_traitement_A,comment dire...,2,,0
Entretien 01 24.12.26_traitement_A,"Ouais, j'étais chargé, en fait, de...",6,,0
Entretien 01 24.12.26_traitement_A,"j'étais responsable technique, en fait, dans une agence qui faisait de la fabrication, vente et pose de fenêtres en PVC.",20,,0
Entretien 01 24.12.26_traitement_A,Voilà.,1,,0
Entretien 01 24.12.26_traitement_A,"Donc, j'étais chargé de regarder les...",6,,0
Entretien 01 24.12.26_traitement_A,"prendre les cotes, organiser les poses, etc., enfin bon, tout ce qui était technique, et vérification des marges, et planification.",20,,0
Entretien 01 24.12.26_traitement_A,"Et après, je me suis installé mon compte en 2005.",10,,0
Entretien 01 24.12.26_traitement_A,"Depuis 89, moins un an et demi, oui.",8,,0
Entretien 01 24.12.26_traitement_A,"Alors, journée de travail classique.",5,,0
Entretien 01 24.12.26_traitement_A,"Je suis très casse pied avec mes apprentis, parce que c'est hors de question pour moi qu'ils arrivent à 8h pile.",21,,0
Entretien 01 24.12.26_traitement_A,"S'ils sont à 8h pile, ça veut dire qu'ils sont en retard.",12,,0
Entretien 01 24.12.26_traitement_A,"Par contre, on prend le temps de boire le café le matin, peinard.",13,,0
Entretien 01 24.12.26_traitement_A,"Donc, on attaque rarement à 8h pile.",7,,0
Entretien 01 24.12.26_traitement_A,"En réalité, on attaque plutôt beaucoup plus tard.",8,,0
Entretien 01 24.12.26_traitement_A,"Parce que ce qui m'intéresse, en fait, c'est pas nécessairement le nombre d'heures qu'on passe, mais surtout le boulot qui était fait à la fin de la journée.",28,,0
Entretien 01 24.12.26_traitement_A,"Donc, café.",2,,0
Entretien 01 24.12.26_traitement_A,"Et souvent, pendant le café, on va discuter de ce qu'on fait, de ce qu'on a fait ou de ce qu'on va faire.",23,,0
Entretien 01 24.12.26_traitement_A,"A bâton rompu, comme ça, tranquille.",6,,0
Entretien 01 24.12.26_traitement_A,C'est pas un briefing.,4,,0
Entretien 01 24.12.26_traitement_A,"Et ensuite, je vais m'occuper, si je parle de ma journée à moi, je vais m'occuper de mettre mon apprenti en route.",22,,0
Entretien 01 24.12.26_traitement_A,"Et ensuite, moi, ça dépend de ce qu'il y a.",10,,0
Entretien 01 24.12.26_traitement_A,C'est-à-dire que j'ai une journée qui est extrêmement hachée au niveau du travail.,13,,0
Entretien 01 24.12.26_traitement_A,Je suis très inefficace en journée parce que j'ai une journée qui est très hachée.,15,,0
Entretien 01 24.12.26_traitement_A,Je vais sauter d'un truc à l'autre.,7,,0
Entretien 01 24.12.26_traitement_A,"Donc, je vais avoir des coups de téléphone, des appels téléphoniques, soit que je vais devoir passer, soit que je vais passer moi.",23,,0
Entretien 01 24.12.26_traitement_A,"Et ça, je vais le faire pendant que je bosse.",10,,0
Entretien 01 24.12.26_traitement_A,"Donc, c'est vrai que c'est pas des journées qui sont très cohérentes vu de l'extérieur.",15,,0
Entretien 01 24.12.26_traitement_A,"Et pourtant, il faut être efficace.",6,,0
Entretien 01 24.12.26_traitement_A,"Alors après, il y a des périodes où je vais volontairement pas toucher au téléphone, suivant le type de travail que je fais.",23,,0
Entretien 01 24.12.26_traitement_A,"Où là, ça peut bien sonner, je m'en fous.",9,,0
Entretien 01 24.12.26_traitement_A,"Parce que, de toute façon, je suis dans le boulot et que il n'y a que ça qui compte.",19,,0
Entretien 01 24.12.26_traitement_A,"Et les appels, ça sera après pour répondre aux appels.",10,,0
Entretien 01 24.12.26_traitement_A,Et une partie de ma journée en fait est effectivement occupée à suivre mon jeune.,15,,0
Entretien 01 24.12.26_traitement_A,"C'est-à-dire que je bosse tout en suivant mon jeune, ou en suivant mes jeunes si j'ai un stagiaire.",18,,0
Entretien 01 24.12.26_traitement_A,"Et généralement, pendant que je bosse manuellement, je fais d'autres choses dans ma tête.",14,,0
Entretien 01 24.12.26_traitement_A,"C'est-à-dire qu'aujourd'hui, l'immense majorité des tâches que je fais, des tâches manuelles que je fais, ne nécessitent pas trop de concentration intellectuelle en permanence.",24,,0
Entretien 01 24.12.26_traitement_A,Ce qui fait que j'ai le cerveau qui travaille à d'autres choses.,12,,0
Entretien 01 24.12.26_traitement_A,"Soit au niveau de ce qu'il faut que je fasse administrativement, soit à réfléchir à un prix pour un client, ou réfléchir à une conception d'un ouvrage au jour d'après.",30,,0
Entretien 01 24.12.26_traitement_A,C'est un petit peu ça mes journées.,7,,0
Entretien 01 24.12.26_traitement_A,"Je dirais que les réalisations techniques manuelles sont très secondaires en réalité, aujourd'hui.",13,,0
Entretien 01 24.12.26_traitement_A,"Sauf quand je fais des ouvrages délicats, où là, par contre, je vais avoir 100% de ma concentration qui est sur cet ouvrage-là, et par contre, où le reste n'existe pas.",31,,0
Entretien 01 24.12.26_traitement_A,Un geste en particulier ?,5,,0
Entretien 01 24.12.26_traitement_A,Waouh !,2,,0
Entretien 01 24.12.26_traitement_A,"Ça, c'est pas facile.",4,,0
Entretien 01 24.12.26_traitement_A,"Et bien, alors là, un geste...",6,,0
Entretien 01 24.12.26_traitement_A,"Ah oui, alors il y a un truc en forge.",10,,0
Entretien 01 24.12.26_traitement_A,"Si on parle de la forge, parce qu'en réalité, mon métier, ce n'est pas que la forge, c'est plein d'autres choses.",21,,0
Entretien 01 24.12.26_traitement_A,C'est pour ça que j'avais du mal à penser à un geste.,12,,0
Entretien 01 24.12.26_traitement_A,"Je pensais plus, en fait, à des astuces, à ce qu'on appelle des tours de métier.",16,,0
Entretien 01 24.12.26_traitement_A,"Donc des petites combines, pour arriver à ne pas se casser les pieds, à faire un truc.",17,,0
Entretien 01 24.12.26_traitement_A,"Un geste en particulier, oui.",5,,0
Entretien 01 24.12.26_traitement_A,J'ai un...,2,,0
Entretien 01 24.12.26_traitement_A,Comment dire ?,3,,0
Entretien 01 24.12.26_traitement_A,"Lorsque je dois étirer du métal au marteau, pour faire par exemple une pointe à partir d'un fer carré, faire une pointe sur ce fer carré, j'ai une façon de poser le marteau sur le fer.",36,,0
Entretien 01 24.12.26_traitement_A,"Alors évidemment, je ne le pose pas, c'est...",8,,0
Entretien 01 24.12.26_traitement_A,un abus de langage.,4,,0
Entretien 01 24.12.26_traitement_A,"Où mon marteau va se poser très légèrement en biais sur l'arête, ce qui fait que par son centre de gravité, le marteau va se remettre à plat, et en se remettant à plat, il étire le fer.",38,,0
Entretien 01 24.12.26_traitement_A,Ce qui me permet...,4,,0
Entretien 01 24.12.26_traitement_A,"Quand je forge par exemple avec les copains au BIP, avec mon marteau seul, je vais aussi vite qu'un frappeur avec une masse, et l'autre avec son marteau.",28,,0
Entretien 01 24.12.26_traitement_A,"C'est-à-dire que je vais aussi vite seul qu'à deux, dont un des deux avec une masse, pour étirer.",18,,0
Entretien 01 24.12.26_traitement_A,"Et ce n'est pas parce que je suis un double-muscle, c'est juste ce petit détail.",15,,0
Entretien 01 24.12.26_traitement_A,"Et par contre, ce n'est pas facile, dans le sens où c'est...",12,,0
Entretien 01 24.12.26_traitement_A,un ou deux degrés peut être d'angle sur le marteau.,10,,0
Entretien 01 24.12.26_traitement_A,Pas plus.,2,,0
Entretien 01 24.12.26_traitement_A,Et il faut qu'il soit bien.,6,,0
Entretien 01 24.12.26_traitement_A,"C'est-à-dire que si on en met trop, ça ne marche pas.",11,,0
Entretien 01 24.12.26_traitement_A,"Si on en met trop peu, ça ne marche pas non plus.",12,,0
Entretien 01 24.12.26_traitement_A,"Alors, je vais vous amener une nuance.",7,,0
Entretien 01 24.12.26_traitement_A,"Je ne suis pas sûr de l'avoir inventé, par contre, ce geste.",12,,0
Entretien 01 24.12.26_traitement_A,Et je suis sûr de ne pas être le seul à utiliser ce système-là.,14,,0
Entretien 01 24.12.26_traitement_A,"Au niveau du geste, il faut comprendre qu'un coup de marteau de forge, dans cette phase-là de travail, c'est un coup de marteau claqué.",24,,0
Entretien 01 24.12.26_traitement_A,C'est-à-dire que ça ressemble plus au claquement de la main sur la peau d'un tambour qu'à la pression.,18,,0
Entretien 01 24.12.26_traitement_A,C'est-à-dire qu'il y a une différence entre appuyer ou...,9,,0
Entretien 01 24.12.26_traitement_A,"En fait, il faut donner de la vitesse au marteau.",10,,0
Entretien 01 24.12.26_traitement_A,C'est pour ça que j'ai des marteaux avec des manches relativement longs et pas nécessairement des manches très...,18,,0
Entretien 01 24.12.26_traitement_A,Comment dire ?,3,,0
Entretien 01 24.12.26_traitement_A,Un marteau très massif avec un manche court.,8,,0
Entretien 01 24.12.26_traitement_A,"Donc, le marteau, forcément, va monter haut, puisque c'est ça qui va lui donner de l'énergie, haut et relativement loin derrière.",21,,0
Entretien 01 24.12.26_traitement_A,Dans la première phase...,4,,0
Entretien 01 24.12.26_traitement_A,C'est pas facile à décrire.,5,,0
Entretien 01 24.12.26_traitement_A,"Dans la première phase, en fait, ma main est relâchée.",10,,0
Entretien 01 24.12.26_traitement_A,Elle n'est pas crispée dessus.,5,,0
Entretien 01 24.12.26_traitement_A,"Le relâcher, je me comprends.",5,,0
Entretien 01 24.12.26_traitement_A,Elle n'est pas non plus libre.,6,,0
Entretien 01 24.12.26_traitement_A,Mais le manche va être tenu essentiellement par la paume de la main et le petit doigt.,17,,0
Entretien 01 24.12.26_traitement_A,C'est le petit doigt qui verrouille.,6,,0
Entretien 01 24.12.26_traitement_A,"Mais le reste des doigts est relativement détendu, je dirais, quand il est en haut et derrière la tête, le marteau.",21,,0
Entretien 01 24.12.26_traitement_A,C'est pas facile à décrire.,5,,0
Entretien 01 24.12.26_traitement_A,"Dans toute cette course d'élan en fait qui descend, le marteau est toujours sur l'arrière en fait, comment dire, presque le manche serait perpendiculaire à mon avant-bras, pour décrire avec des mots.",32,,0
Entretien 01 24.12.26_traitement_A,"Et sur la dernière phase, au moment où, juste avant qu'il frappe, là, le marteau va décrire, entre guillemets, un deuxième arc de cercle, parce qu'il y a un premier arc de cercle qui est fait avec le mouvement de la main, comme ça, et le deuxième arc de cercle, où là, il va fouetter, en fait, vraiment, et prendre beaucoup de vitesse dans cette phase-là.",66,,0
Entretien 01 24.12.26_traitement_A,"Dans cette phase-là, il est nécessaire que la main soit un tout petit peu plus, comment dire, elle ait un petit peu plus de prise sur le manche, parce que forcément, il y a plus de vitesse, donc sinon, il s'échapperait.",41,,0
Entretien 01 24.12.26_traitement_A,Il faut avoir de la prise suffisamment de prise également pour qu'il soit guidé avec précision.,16,,0
Entretien 01 24.12.26_traitement_A,"Guidé, j'entends au niveau de l'orientation de la table, pas de l'endroit où il tape.",15,,0
Entretien 01 24.12.26_traitement_A,"L'endroit où il tape, ça fait longtemps que c'est décidé, en réalité.",12,,0
Entretien 01 24.12.26_traitement_A,"Dès le début de la course, en fait, l'endroit où il tape est choisi ou raté.",16,,0
Entretien 01 24.12.26_traitement_A,Et guidé dans le sens oui où il faut que la table soit positionnée de façon parfaite.,17,,0
Entretien 01 24.12.26_traitement_A,"Quand on parle de la table des marteaux, c'est la surface plane des marteaux.",14,,0
Entretien 01 24.12.26_traitement_A,"Et au moment où il claque, en fait, là, la main va, à un court instant, être libérée, en fait, elle va libérer le manche, entre guillemets.",27,,0
Entretien 01 24.12.26_traitement_A,"On ne le lâche pas, évidemment, mais on n'est pas crispé dessus.",12,,0
Entretien 01 24.12.26_traitement_A,"Et on profite du rebond, parce qu'il va claquer sur le métal, et à ce moment-là, il rebondit, comme une balle rebondit par terre.",24,,0
Entretien 01 24.12.26_traitement_A,"Et on profite du rebond pour ramener la masse du marteau relativement proche du corps, pour ensuite le relever verticalement.",20,,0
Entretien 01 24.12.26_traitement_A,"C'est-à-dire qu'en fait, ça ne fait pas un arc de cercle à l'aller et un arc de cercle au retour.",20,,0
Entretien 01 24.12.26_traitement_A,C'est un geste qui est beaucoup plus complexe que ça.,10,,0
Entretien 01 24.12.26_traitement_A,"Alors on va avoir une descente, en fait, sur un arc de cercle, un micro-arc de cercle, avec comme point de centre la main, qui, lui, va lui donner beaucoup de vitesse et claquer.",34,,0
Entretien 01 24.12.26_traitement_A,"Et au moment où il a claqué, on se sert du rebond pour le ramener vers soi.",17,,0
Entretien 01 24.12.26_traitement_A,"Et en fait, il fait presque une ligne droite au niveau de la masse.",14,,0
Entretien 01 24.12.26_traitement_A,Presque une ligne droite pour remonter derrière la tête.,9,,0
Entretien 01 24.12.26_traitement_A,Il ne fait pas un arc de cercle.,8,,0
Entretien 01 24.12.26_traitement_A,"Ce n'est pas un geste mécanique comme on pourrait le faire avec un marteau monté sur un axe, sur un long manche sur un axe.",25,,0
Entretien 01 24.12.26_traitement_A,"En fait, c'est au moment où il se pose.",9,,0
Entretien 01 24.12.26_traitement_A,"C'est-à-dire que si on a ici la largeur du marteau, à un moment où il se pose, il ne va pas se poser pile à plat.",26,,0
Entretien 01 24.12.26_traitement_A,"Une table de marteau, de toute façon, n'est pas plate.",10,,0
Entretien 01 24.12.26_traitement_A,Elle est toujours légèrement bombée.,5,,0
Entretien 01 24.12.26_traitement_A,Il ne va pas se poser pile à plat.,9,,0
Entretien 01 24.12.26_traitement_A,Il va se poser légèrement sur l'arête.,7,,0
Entretien 01 24.12.26_traitement_A,"Et en se posant sur l'arête, le centre de gravité du marteau fait qu'il va avoir envie de se remettre à plat.",22,,0
Entretien 01 24.12.26_traitement_A,"Et donc, il va faire comme ça.",7,,0
Entretien 01 24.12.26_traitement_A,"Et en se remettant à plat, cette arête-là glisse légèrement autour du centre de gravité.",15,,0
Entretien 01 24.12.26_traitement_A,Elle pivote autour du centre de gravité.,7,,0
Entretien 01 24.12.26_traitement_A,"Et elle tire le métal, en fait.",7,,0
Entretien 01 24.12.26_traitement_A,"Ça, j'en sais rien.",4,,0
Entretien 01 24.12.26_traitement_A,"À quel moment, en fait, cet angle-là se décide ?",10,,0
Entretien 01 24.12.26_traitement_A,"En fait, honnêtement, je ne saurais pas dire.",8,,0
Entretien 01 24.12.26_traitement_A,"Je pense qu'en fait, ça part déjà dès le départ.",10,,0
Entretien 01 24.12.26_traitement_A,"C'est-à-dire que dès le départ, il a déjà, en fait...",10,,0
Entretien 01 24.12.26_traitement_A,Il a déjà son angle de choisi.,7,,0
Entretien 01 24.12.26_traitement_A,Je ne le choisis pas en cours de route.,9,,0
Entretien 01 24.12.26_traitement_A,Je ne le choisis pas en cours de route.,9,,0
Entretien 01 24.12.26_traitement_A,"Il faut avoir en tête, en fait, qu'on pense...",9,,0
Entretien 01 24.12.26_traitement_A,"Enfin, moi, quand je frange fort, je pense le métal comme de la pâte à modeler.",16,,0
Entretien 01 24.12.26_traitement_A,"Et souvent, en fait, on ne le pense pas avec le marteau, mais on le pense comme si on modelait à la main, à main nue.",26,,0
Entretien 01 24.12.26_traitement_A,"Ça paraît bizarre, mais...",4,,0
Entretien 01 24.12.26_traitement_A,"Alors, moi, j'ai deux façons de forger.",7,,0
Entretien 01 24.12.26_traitement_A,Soit je forge...,3,,0
Entretien 01 24.12.26_traitement_A,Oui.,1,,0
Entretien 01 24.12.26_traitement_A,"Mais sur cette étape de frappe aussi, parce que ça...",10,,0
Entretien 01 24.12.26_traitement_A,Il y a une partie de votre question qui en fait partie.,12,,0
Entretien 01 24.12.26_traitement_A,J'ai deux façons d'appréhender la forge.,6,,0
Entretien 01 24.12.26_traitement_A,"Soit, en fait, je forge pour gagner ma vie, soit je forge pour le plaisir.",15,,0
Entretien 01 24.12.26_traitement_A,"Ça va être bizarre, mais quand je forge pour gagner ma vie, je me fais évidemment plaisir, mais c'est pas le but.",22,,0
Entretien 01 24.12.26_traitement_A,"Je forge pour gagner ma vie, et j'ai donc une notion de production.",13,,0
Entretien 01 24.12.26_traitement_A,"Dans le fait que je forge, j'ai une notion de production qui est importante.",14,,0
Entretien 01 24.12.26_traitement_A,"Donc, dans cette notion de production, le boulot doit avancer vite et bien.",13,,0
Entretien 01 24.12.26_traitement_A,"Donc, le plaisir, il vient...",5,,0
Entretien 01 24.12.26_traitement_A,Il est complètement secondaire pour moi.,6,,0
Entretien 01 24.12.26_traitement_A,Complètement secondaire.,2,,0
Entretien 01 24.12.26_traitement_A,Parce que c'est la production qui compte.,7,,0
Entretien 01 24.12.26_traitement_A,"C'est ça, l'objectif.",3,,0
Entretien 01 24.12.26_traitement_A,"Donc, pour le...",3,,0
Entretien 01 24.12.26_traitement_A,Comment dire ?,3,,0
Entretien 01 24.12.26_traitement_A,La question de...,3,,0
Entretien 01 24.12.26_traitement_A,J'ai perdu le fil de la question que vous m'avez posée.,11,,0
Entretien 01 24.12.26_traitement_A,"Alors, les étapes qui me demandent de l'attention...",8,,0
Entretien 01 24.12.26_traitement_A,"Alors, au niveau de l'attention, en réalité, au moment où je forge, j'ai pas besoin d'être attentif.",17,,0
Entretien 01 24.12.26_traitement_A,C'est-à-dire que j'ai déjà réfléchi à comment j'allais procéder pour mener mon ouvrage.,13,,0
Entretien 01 24.12.26_traitement_A,C'est-à-dire que j'ai déjà réfléchi aux différentes étapes de mon ouvrage avant de commencer à forger.,16,,0
Entretien 01 24.12.26_traitement_A,Non.,1,,0
Entretien 01 24.12.26_traitement_A,"Alors, souvent, là où je vais réfléchir, c'est pendant que mon fer est dans le feu.",16,,0
Entretien 01 24.12.26_traitement_A,"Et c'est ce que j'explique aux jeunes, d'ailleurs, c'est qu'une fois que le fer sort du feu, c'est trop tard pour réfléchir.",22,,0
Entretien 01 24.12.26_traitement_A,"Il fallait réfléchir avant, ou il faut le remettre dans le feu, baisser la quantité d'air pour pas qu'il brûle, et c'est là qu'on réfléchit.",25,,0
Entretien 01 24.12.26_traitement_A,Hum...,1,,0
Entretien 01 24.12.26_traitement_A,"Non, je pense pas.",4,,0
Entretien 01 24.12.26_traitement_A,"Vider l'esprit, pour moi, c'est pas le bon mot, dans le sens où...",13,,0
Entretien 01 24.12.26_traitement_A,"Non, moi, je suis concentré dans ce que je fais.",10,,0
Entretien 01 24.12.26_traitement_A,Je suis concentré sur la précision et la qualité de mon geste.,12,,0
Entretien 01 24.12.26_traitement_A,"Sur tout le déroulé, en fait, du coup de marteau.",10,,0
Entretien 01 24.12.26_traitement_A,"Enfin, du, c'est pas...",4,,0
Entretien 01 24.12.26_traitement_A,"En fait, ça se joue pas sur un coup de marteau, mais sur...",13,,0
Entretien 01 24.12.26_traitement_A,"Moi, j'appréhende le travail sur une chauffe.",7,,0
Entretien 01 24.12.26_traitement_A,"C'est-à-dire que je sors mon fer chaud, et en fait, c’est tant qu'il est chaud, je bosse dessus.",18,,0
Entretien 01 24.12.26_traitement_A,"Et en fait, c'est pas sur un coup de marteau ou un geste, c'est sur ce déroulé de cette multitude de gestes, en fait, que j'appréhende le travail.",28,,0
Entretien 01 24.12.26_traitement_A,"Sur une chauffe, en fait.",5,,0
Entretien 01 24.12.26_traitement_A,"On compte pas en gestes, on compte en chauffe, en forge.",11,,0
Entretien 01 24.12.26_traitement_A,Donc sur tout ce déroulé des gestes...,7,,0
Entretien 01 24.12.26_traitement_A,"Non, pour moi, il y a de la concentration.",9,,0
Entretien 01 24.12.26_traitement_A,La concentration...,2,,0
Entretien 01 24.12.26_traitement_A,"Il y a beaucoup d'observations de l'évolution de ce que je fais, de façon à pouvoir réagir en fonction de l'évolution de l'ouvrage, de comment il fonctionne.",27,,0
Entretien 01 24.12.26_traitement_A,"Après, il va y avoir des choses très particulières.",9,,0
Entretien 01 24.12.26_traitement_A,"Par exemple, en ce moment, je suis en train de me perfectionner en soudure à la forge.",17,,0
Entretien 01 24.12.26_traitement_A,J'ai cette volonté-là de me perfectionner.,6,,0
Entretien 01 24.12.26_traitement_A,"Je sais souder à la forge depuis des années, mais c'est pas aussi intuitif et facile pour moi de souder à la forge que de souder avec un procédé moderne à la baguette ou au semi-automatique.",36,,0
Entretien 01 24.12.26_traitement_A,Et j'ai envie que ça le devienne.,7,,0
Entretien 01 24.12.26_traitement_A,J'ai envie que souder à la forge devienne aussi simple que de souder avec un procédé moderne.,17,,0
Entretien 01 24.12.26_traitement_A,"Et donc, cette étape-là, quand le métal est dans le feu et qu'il chauffe, cette étape presque, je dirais, pour moi, c'est de la métallurgie, en fait.",27,,0
Entretien 01 24.12.26_traitement_A,"Cette étape métallurgique de soudure à la forge quand il est dans le feu, parce que 95% du travail de la soudure à la forge se passe dans le feu et 5% sur l’enclume.",34,,0
Entretien 01 24.12.26_traitement_A,"Et ça, c'est quelque chose que j'ai eu du mal à comprendre au début.",14,,0
Entretien 01 24.12.26_traitement_A,"Ça, ouais, ça nécessite beaucoup de concentration et là, je suis que dedans.",13,,0
Entretien 01 24.12.26_traitement_A,C'est pas du tout la même chose.,7,,0
Entretien 01 24.12.26_traitement_A,"Ah, du point de vue du matériau.",7,,0
Entretien 01 24.12.26_traitement_A,"Ouais, je vois.",3,,0
Entretien 01 24.12.26_traitement_A,"Alors, le matériau, donc il va évidemment subir un écrasement, pour moi, il n'y a pas d'onde de choc.",19,,0
Entretien 01 24.12.26_traitement_A,C'est pas comme ça que je le ressens.,8,,0
Entretien 01 24.12.26_traitement_A,"Alors attention, je ne parle pas en termes scientifiques, je parle juste en termes de ressenti.",16,,0
Entretien 01 24.12.26_traitement_A,"Pour moi, en fait, il subit un écrasement, mais un étirement.",11,,0
Entretien 01 24.12.26_traitement_A,"C'est-à-dire que le but du jeu de ce placement un peu particulier du marteau, c'est de guider l'étirement.",18,,0
Entretien 01 24.12.26_traitement_A,"C'est-à-dire que si on se contente, si on pose le marteau à plat, comme j'ai l'habitude de dire, si on pose le marteau à plat sur le fer, eh bien, il va être écrasé, entre guillemets, dans les deux directions, de façon équivalente.",43,,0
Entretien 01 24.12.26_traitement_A,"Le geste que je fais quand je fais ça, parce qu’attention, ce n’est pas systématique, c'est pas tous les coups de marteau, et c'est pas tout le temps que je fais ça.",32,,0
Entretien 01 24.12.26_traitement_A,"C'est-à-dire que c'est à la demande, bien sûr, quand j'ai besoin d'étirer, et d'étirer certaines choses, et de les étirer rapidement, que je fais comme ça.",26,,0
Entretien 01 24.12.26_traitement_A,"Le fait de le poser en biais fait que, d'abord, il est écrasé plus ponctuellement, suivant une arête, et donc, suivant cette arête, ça va guider le métal dans une direction donnée, et ça le guide en même temps que ça l'étire.",42,,0
Entretien 01 24.12.26_traitement_A,"Et ça, je ressens vraiment bien ce glissement, ce glissement du métal.",12,,0
Entretien 01 24.12.26_traitement_A,"Alors, c'est pas adapté à tous les ouvrages.",8,,0
Entretien 01 24.12.26_traitement_A,"C'est-à-dire que, moi, là, je parle en tant que ferronnier, mais par exemple, un coutelier, suivant ce qu'il fait, ça serait pas du tout bon, métallurgiquement parlant.",27,,0
Entretien 01 24.12.26_traitement_A,"Parce que, alors oui, on va étirer dans le bon sens, mais on le fait souffrir quand même.",18,,0
Entretien 01 24.12.26_traitement_A,"C'est-à-dire que, si j'ai un outil à faire, je vais pas forcément utiliser cette méthode-là.",15,,0
Entretien 01 24.12.26_traitement_A,"Un outil en acier, un outil tranchant à faire, je vais pas forcément utiliser cette méthode-là.",16,,0
Entretien 01 24.12.26_traitement_A,Ou alors avec modération.,4,,0
