filename,text,word_count,tools,tool_number
Entretien 01 25.03.13 03_traitement_A,Ah oui.,2,,0
Entretien 01 25.03.13 03_traitement_A,"Après, là par exemple, il n'y a pas très longtemps, on a fait un travail qui était intéressant avec les CAP sur le travail du rembordage.",26,,0
Entretien 01 25.03.13 03_traitement_A,"Le rembordage, c'est comme faire un ourlet, mais le terme « ourlet » en cuir, c'est rembord.",17,,0
Entretien 01 25.03.13 03_traitement_A,"Pour les élèves, sur des lignes droites, ça se passe bien.",11,,0
Entretien 01 25.03.13 03_traitement_A,Les difficultés commencent sur les lignes convexes ou les lignes concaves.,11,,0
Entretien 01 25.03.13 03_traitement_A,Il y a des outils à utiliser.,7,,0
Entretien 01 25.03.13 03_traitement_A,"Des fois, on fait des fentes, des plis.",8,,0
Entretien 01 25.03.13 03_traitement_A,C'est un geste qui est loin d'être facile à faire.,10,,0
Entretien 01 25.03.13 03_traitement_A,Ça a pris beaucoup de temps.,6,,0
Entretien 01 25.03.13 03_traitement_A,C'est vrai que je fais faire et refaire.,8,,0
Entretien 01 25.03.13 03_traitement_A,"Pour les élèves, ce n'est pas toujours très agréable.",9,,0
Entretien 01 25.03.13 03_traitement_A,Mais je veux arriver.,4,,0
Entretien 01 25.03.13 03_traitement_A,"Mon objectif, c'est qu'il faut qu'ils y arrivent.",8,,0
Entretien 01 25.03.13 03_traitement_A,"Je les apprends à persister dans le travail, qu'ils aient le goût de recommencer, que ce n'est pas grave un échec, qu'on n'y arrive pas.",25,,0
Entretien 01 25.03.13 03_traitement_A,"Le but, c'est d'arriver.",4,,0
Entretien 01 25.03.13 03_traitement_A,"Il faut qu'on y arrive, c'est d'arriver à donner satisfaction aussi, qu'ils soient contents et qu'ils aient une récompense.",19,,0
Entretien 01 25.03.13 03_traitement_A,"Qu’on leur dise que c'est bien parce qu'ils ont besoin d'être valorisés, par exemple au CAP notamment.",17,,0
Entretien 01 25.03.13 03_traitement_A,"Le rembordage, ce n'est pas du piquage.",7,,0
Entretien 01 25.03.13 03_traitement_A,"Par exemple, on va mettre un renfort qui va servir un peu de guide.",14,,0
Entretien 01 25.03.13 03_traitement_A,Ils vont coller et ils vont plier le cuir.,9,,0
Entretien 01 25.03.13 03_traitement_A,"Ils vont rabattre le cuir sur lui-même pour que ça fasse un joli bord, qu'il ne soit pas un bord franc.",21,,0
Entretien 01 25.03.13 03_traitement_A,"Un bord franc, c'est quand on voit la tranche du cuir.",11,,0
Entretien 01 25.03.13 03_traitement_A,"D'abord, il y a la coupe de la pièce.",9,,0
Entretien 01 25.03.13 03_traitement_A,"Nous, on fait ce qu'on appelle un parage, c'est-à-dire qu'on affine le cuir pour que ça puisse se replier parce que les cuirs sont plus ou moins rigides.",28,,0
Entretien 01 25.03.13 03_traitement_A,On est obligé de parer.,5,,0
Entretien 01 25.03.13 03_traitement_A,C'est affiner le cuir sur une certaine largeur.,8,,0
Entretien 01 25.03.13 03_traitement_A,Ce n'est pas sur toute la surface de la pièce.,10,,0
Entretien 01 25.03.13 03_traitement_A,"Après, quand on doit faire des lignes concaves ou convexes, on leur fait poser un petit renfort assez fin.",19,,0
Entretien 01 25.03.13 03_traitement_A,Il ne doit pas se voir à travers la matière.,10,,0
Entretien 01 25.03.13 03_traitement_A,Ils vont le coller à 7 mm du bord.,9,,0
Entretien 01 25.03.13 03_traitement_A,"Ensuite, ils vont mettre de la colle sur environ 14 mm parce que nous, on utilise des colles pour adhérer ces colles contre colles.",24,,0
Entretien 01 25.03.13 03_traitement_A,Ils vont coller ça.,4,,0
Entretien 01 25.03.13 03_traitement_A,Ils vont laisser sécher la colle.,6,,0
Entretien 01 25.03.13 03_traitement_A,Il y a un temps de sèche qui est nécessaire.,10,,0
Entretien 01 25.03.13 03_traitement_A,Ça adhère quand la colle est sèche.,7,,0
Entretien 01 25.03.13 03_traitement_A,"Ensuite, ils vont se servir d'un poinçon pour rabattre et pour faire des petits plis, pour faire par exemple un arrondi.",21,,0
Entretien 01 25.03.13 03_traitement_A,Ces plis doivent être infiniment fins.,6,,0
Entretien 01 25.03.13 03_traitement_A,L'opération de parage est importante.,5,,0
Entretien 01 25.03.13 03_traitement_A,Elles jouent un rôle très important.,6,,0
Entretien 01 25.03.13 03_traitement_A,"Et ensuite, ces plis sont tapés.",6,,0
Entretien 01 25.03.13 03_traitement_A,Il doit y avoir très peu de volume.,8,,0
Entretien 01 25.03.13 03_traitement_A,À quoi on pense ?,5,,0
Entretien 01 25.03.13 03_traitement_A,À quoi l'élève pense ?,5,,0
Entretien 01 25.03.13 03_traitement_A,C'est surtout la gestuelle qui est importante.,7,,0
Entretien 01 25.03.13 03_traitement_A,"Bien sûr, la concentration.",4,,0
Entretien 01 25.03.13 03_traitement_A,"Plus on est concentré, je pense que la concentration est liée aussi au travail bien fait.",16,,0
Entretien 01 25.03.13 03_traitement_A,Le geste sera fait comme il faut.,7,,0
Entretien 01 25.03.13 03_traitement_A,Ça demande de la patience.,5,,0
Entretien 01 25.03.13 03_traitement_A,C'est lié aussi à la patience.,6,,0
Entretien 01 25.03.13 03_traitement_A,Le parage.,2,,0
Entretien 01 25.03.13 03_traitement_A,"Il faut faire attention quand on part à la machine, il y a un guide.",15,,0
Entretien 01 25.03.13 03_traitement_A,"Et si on veut que le parage soit bien fait, il faut se tenir au bord de ce guide, mais il ne faut pas trop appuyer.",26,,0
Entretien 01 25.03.13 03_traitement_A,Il ne faut pas être en retrait du guide.,9,,0
Entretien 01 25.03.13 03_traitement_A,"Quand l'élève travaille, il ne faut pas qu'il soit perturbé par un élément extérieur.",14,,0
Entretien 01 25.03.13 03_traitement_A,Il faut qu'il soit bien concentré.,6,,0
Entretien 01 25.03.13 03_traitement_A,"Oui, à l'instant où il va sortir sa pièce, qu'il aura fini sa pièce et qu'il va en prendre une autre, j'ai envie de dire.",25,,0
Entretien 01 25.03.13 03_traitement_A,"Mais bon, non.",3,,0
Entretien 01 25.03.13 03_traitement_A,"De toute façon, l'attention, c'est quelque chose qui doit être de manière régulière.",13,,0
Entretien 01 25.03.13 03_traitement_A,"Le matériau, on lui met de la colle dessus.",9,,0
Entretien 01 25.03.13 03_traitement_A,"De la colle à base d'eau, alors qu'avant on mettait de la colle néoprène.",14,,0
Entretien 01 25.03.13 03_traitement_A,"Je trouve qu'il est un peu moins agressé qu'avant, déjà.",10,,0
Entretien 01 25.03.13 03_traitement_A,Il est plié.,3,,0
Entretien 01 25.03.13 03_traitement_A,"Pour faire du rembordage, par exemple, ce fameux « ourlet », on ne peut pas faire ça sur tous les cuirs.",21,,0
Entretien 01 25.03.13 03_traitement_A,"Un cuir qui est trop raide, la fleur va se casser.",11,,0
Entretien 01 25.03.13 03_traitement_A,"La fleur du cuir, c'est le côté extérieur du cuir.",10,,0
Entretien 01 25.03.13 03_traitement_A,C'est l'endroit du cuir.,4,,0
Entretien 01 25.03.13 03_traitement_A,Le choix du matériau est important.,6,,0
Entretien 01 25.03.13 03_traitement_A,"Quand on vient taper, même si on le fait doucement, on agresse un peu le cuir.",16,,0
Entretien 01 25.03.13 03_traitement_A,Il peut y avoir des mauvaises surprises.,7,,0
Entretien 01 25.03.13 03_traitement_A,"Parfois, les élèves choisissent des cuirs.",6,,0
Entretien 01 25.03.13 03_traitement_A,Je leur laisse parfois choisir des cuirs.,7,,0
Entretien 01 25.03.13 03_traitement_A,Ils peuvent découvrir qu'ils n'ont pas fait le bon choix.,10,,0
Entretien 01 25.03.13 03_traitement_A,Je trouve que c'est intéressant.,5,,0
Entretien 01 25.03.13 03_traitement_A,Il y a un intérêt à ça aussi.,8,,0
Entretien 01 25.03.13 03_traitement_A,"Je trouve que c'est un peu un matériau vivant, même si c'est de la peau d'un animal mort.",18,,0
Entretien 01 25.03.13 03_traitement_A,Il demande du respect.,4,,0
Entretien 01 25.03.13 03_traitement_A,Il faut qu'il soit respecté ce matériau.,7,,0
Entretien 01 25.03.13 03_traitement_A,On dit que le cuir est une matière noble.,9,,0
Entretien 01 25.03.13 03_traitement_A,Ça sous-entend qu'il faut prendre soin de lui.,8,,0
Entretien 01 25.03.13 03_traitement_A,"Le cuir, c'est quelque chose qui est fragile, qui se raye, qu'on doit manipuler avec des outils, avec précaution.",19,,0
Entretien 01 25.03.27 01_traitement_A,Depuis 6 mois.,3,,0
Entretien 01 25.03.27 01_traitement_A,C'est ça.,2,,0
Entretien 01 25.03.27 01_traitement_A,Là où je travaille ?,5,,0
Entretien 01 25.03.27 01_traitement_A,"Alors, j'arrive, j'allume les glory, ensuite je passe le ménage, je fais le balai, parce que le soir, on reste jusqu'à la fin, et donc au moment où on a fini notre travail, c'est l'heure de partir.",37,,0
Entretien 01 25.03.27 01_traitement_A,On ne prévoit pas de faire le ménage avant de partir.,11,,0
Entretien 01 25.03.27 01_traitement_A,"Du coup, on le fait le matin, en attendant que les fours chauffent.",13,,0
Entretien 01 25.03.27 01_traitement_A,"Ensuite, je mets les cannes à chauffer, en fonction de ce qu'on va faire comme pièce.",16,,0
Entretien 01 25.03.27 01_traitement_A,"Ça peut être des grosses cannes, plus des apports, plus de ferrées, ça dépend.",14,,0
Entretien 01 25.03.27 01_traitement_A,"Ensuite, on discute avec les artistes ou les designers, en fonction s'il y a du nouveau, ce qu'ils veulent faire exactement.",21,,0
Entretien 01 25.03.27 01_traitement_A,"Ensuite, je prépare les couleurs, donc s'il y a de la balotte, s'ils veulent des pièces en couleur, je coupe les morceaux, je les mets à réchauffer, et ensuite, on attaque la pièce.",33,,0
Entretien 01 25.03.27 01_traitement_A,"Donc souvent, comme je suis apprenti, c'est pas moi qui réalise la pièce en entier, mais je débute, je prépare la couleur au bout de la canne, je la souffle.",30,,0
Entretien 01 25.03.27 01_traitement_A,"Parfois, je fais un cueillage ou deux, et ensuite, après, c'est en fonction de ce qu'il y a besoin.",19,,0
Entretien 01 25.03.27 01_traitement_A,"Ensuite, j'aide à ouvrir les portes du glory, à faire un pontil, parfois, dès qu'il y a besoin, en fonction de mes capacités, et toujours dans l'idée d'apprendre.",28,,0
Entretien 01 25.03.27 01_traitement_A,"Alors ça, c'est une journée classique.",6,,0
Entretien 01 25.03.27 01_traitement_A,"Ensuite, parfois, je suis appelé pour aller parachever les pièces des artistes, soit c'est parce qu'il y a moins de travail à chaud, donc je vais à froid, et sinon, c'est la journée du vendredi, elle est dédiée complètement à...",40,,0
Entretien 01 25.03.27 01_traitement_A,"On souffle pas, il n'y a pas les fours, et le vendredi, on va parachever les pièces qu'on a faites dans la semaine, et puis s'il y en a d'autres à faire, les commandes, voilà.",35,,0
Entretien 01 25.03.27 01_traitement_A,"Et une fois qu'on a fini, on éteint les glory, on éteint le chauffe-cannes, on éteint tout, on met l'arche de recuisson en descente, et puis on s'en va.",29,,0
Entretien 01 25.03.27 01_traitement_A,"Toutes les pièces qu'on fait en soufflage, on les met à recuire dans un four qui est à 510 degrés, comme ça, pendant qu'on travaille, il est tout le temps à 510, et une fois qu'on a fini notre journée de travail, hop, on les met à redescendre, soit on l'arrête et il y a une inertie, ou soit il y a une courbe de recuisson, donc petit à petit, ça va descendre.",73,,0
Entretien 01 25.03.27 01_traitement_A,"Normalement, souvent, le lendemain matin, on récupère les pièces.",9,,0
Entretien 01 25.03.27 01_traitement_A,"Voilà, elles sont à température ambiante, mais parfois, quand c'est des grosses pièces où il y a de la masse, on laisse plus d'une journée...",25,,0
Entretien 01 25.03.27 01_traitement_A,"Je dirais que c'est souffler au pouce, parce qu'il faut aller assez vite, quand même, ne pas perdre l'axe, surtout si on le travaille assez chaud le verre.",28,,0
Entretien 01 25.03.27 01_traitement_A,"C'est un geste qui, au début, on ne sait pas trop le faire.",13,,0
Entretien 01 25.03.27 01_traitement_A,"Donc on souffle, ensuite on met notre pouce, mais si on ne met pas assez vite, la pression s'en va, et donc la bulle ne sort pas.",27,,0
Entretien 01 25.03.27 01_traitement_A,"Ensuite, il y a aussi quelque chose qui est une notion de confiance en soi et confiance en son savoir-faire, parce que parfois, le verre est un peu froid.",29,,0
Entretien 01 25.03.27 01_traitement_A,"Donc on souffle au pouce, on laisse le pouce, et la bulle met un peu de temps à venir.",19,,0
Entretien 01 25.03.27 01_traitement_A,Elle n'arrive pas tout de suite dans la seconde.,9,,0
Entretien 01 25.03.27 01_traitement_A,Elle met une seconde ou deux.,6,,0
Entretien 01 25.03.27 01_traitement_A,"Il faut accepter pendant deux secondes de dire, je suis sûr que j'ai bien fait le geste, et là, je garde mon pouce parce que la bulle va arriver.",29,,0
Entretien 01 25.03.27 01_traitement_A,"Le problème de ça, c'est que si jamais on n'a pas bien fait le geste, on a attendu deux secondes ou trois ou quatre, et là, le verre commence à refroidir, donc on va recommencer, parce qu'il va falloir quand même ressouffler au pouce.",44,,0
Entretien 01 25.03.27 01_traitement_A,"Là, le verre est froid, alors ça va un peu moins bien sortir.",13,,0
Entretien 01 25.03.27 01_traitement_A,"Donc c'est un moment où on se dit, est-ce que je l'ai vraiment bien fait, en tout cas au début ?",21,,0
Entretien 01 25.03.27 01_traitement_A,Est-ce que je l'ai vraiment bien fait ou c'est le verre qui est froid ?,15,,0
Entretien 01 25.03.27 01_traitement_A,Puis on voit la bulle qui arrive.,7,,0
Entretien 01 25.03.27 01_traitement_A,On voit tout de suite si c'est parti de travers.,10,,0
Entretien 01 25.03.27 01_traitement_A,"Tout de suite, on va savoir si soit il faut recommencer ou si ça va être compliqué de faire une belle pièce, parce qu'une fois que la bulle est désaxée dans le verre, il va y avoir une épaisseur d'un côté et moins de l'autre, et cette épaisseur-là, on peut la garder tout le long de la pièce.",58,,0
Entretien 01 25.03.27 01_traitement_A,"Si on fait deux, trois, quatre cueillages, c'est compliqué de rectifier, et donc c'est un peu la catastrophe.",18,,0
Entretien 01 25.03.27 01_traitement_A,Donc c'est un truc qui est important.,7,,0
Entretien 01 25.03.27 01_traitement_A,"Après un beau cueillage, souffler au pouce, c'est un geste un peu caché, parce qu'on le fait vite et souvent les gens pensent qu'on souffle fort, alors que juste un petit coup de souffle, on est tout de suite bloqué parce qu'il y a le verre qu'au bout de notre canne, on sent que ça bloque.",56,,0
Entretien 01 25.03.27 01_traitement_A,On met notre pouce tout de suite.,7,,0
Entretien 01 25.03.27 01_traitement_A,"Du coup, on a mis de la pression.",8,,0
Entretien 01 25.03.27 01_traitement_A,"La canne est chaude, donc l'air se dilate.",8,,0
Entretien 01 25.03.27 01_traitement_A,"Il ne peut plus pas sortir du côté de notre pouce parce qu'on a mis notre pouce, donc il sort du côté du verre et ça crée la bulle.",29,,0
Entretien 01 25.03.27 01_traitement_A,Et tout ça tout en tournant pour ne pas que le verre tombe.,13,,0
Entretien 01 25.03.27 01_traitement_A,"Donc ça, c'est un geste que j'aime bien.",8,,0
Entretien 01 25.03.27 01_traitement_A,Ça se fait vraiment en une seconde ou deux.,9,,0
Entretien 01 25.03.27 01_traitement_A,C'est très rapide.,3,,0
Entretien 01 25.03.27 01_traitement_A,"Une fois qu'on a cueilli le premier cueillage au bout de la canne, soit on marbre, soit on mailloche, on le met en forme comme on a envie.",28,,0
Entretien 01 25.03.27 01_traitement_A,"Et ensuite, tout en tournant, on approche de notre canne, de notre bouche, on souffle tout en tournant un minimum.",20,,0
Entretien 01 25.03.27 01_traitement_A,"Des fois, on est un peu à l'arrêt au moment du souffle et c'est pour ça que ce temps d'arrêt, il faut qu'il soit très court, sinon ça désaxe.",29,,0
Entretien 01 25.03.27 01_traitement_A,"Donc tac, on souffle, on s'arrête, on continue de tourner, on bloque avec notre pouce.",15,,0
Entretien 01 25.03.27 01_traitement_A,"Ensuite, on peut aussi jauger de lever notre canne ou la baisser.",12,,0
Entretien 01 25.03.27 01_traitement_A,"Si on la baisse, si on baisse le bout de notre canne vers le bas, la bulle va sortir, mais le verre va couler aussi, donc on va garder du fond.",31,,0
Entretien 01 25.03.27 01_traitement_A,"Si, au contraire, on souffle vers le haut, le verre va descendre et la bulle va percer le fond.",19,,0
Entretien 01 25.03.27 01_traitement_A,C'est déjà les prémices des épaisseurs qu'on veut avoir en fonction du travail qu'on veut faire après.,17,,0
Entretien 01 25.03.27 01_traitement_A,"Déjà, là, c'est 2-3 secondes où tout va se jouer.",10,,0
Entretien 01 25.03.27 01_traitement_A,"Si on a mal marbré, mal mailloché, si on souffle de travers, si on est trop vers le haut, trop vers le bas, ça ne va pas faire ce qu'on veut en 3-4 secondes.",34,,0
Entretien 01 25.03.27 01_traitement_A,C'est ça que j'aime bien.,5,,0
Entretien 01 25.03.27 01_traitement_A,"Oui, c'est ça.",3,,0
Entretien 01 25.03.27 01_traitement_A,"Alors, pendant que je souffle au pouce, je me concentre surtout sur garder l'axe quand je tourne, bien tourner.",19,,0
Entretien 01 25.03.27 01_traitement_A,"Et sinon, c'est plus l'avant, entre cueillir, bien amorcer, mettre la bonne quantité que je souhaite, faire un beau cueillage, bien rond, qu'il soit beau en soi, ensuite sortir, refroidir ma canne, prendre le temps d'attendre que le verre refroidisse un petit peu, et ensuite marbrer, c'est là où il faut aller tout doux, parce que le verre, quand il sort, il est très très très liquide, et là, s'il est fragile, le moins de choc, il le garde un petit peu.",82,,0
Entretien 01 25.03.27 01_traitement_A,"Donc il faut aller tout doux, on marbre doucement, on amène le verre un peu plus vers l'avant parfois, hop, on marbre, petit à petit, le marbre est froid, donc il est refroidi, ces gestes-là, pour moi, c'est la concentration, d'arriver à faire un beau cylindre, que le bout soit arrondi, parce que déjà, si quand on marbre, il y a déjà des bosses où ce n'est pas beau, il n'y a pas de justice, il faut le faire bien, parce que sinon, ce n'est pas en soufflant au pouce après que tout ça va se remettre bien, c'est faire bien à chaque fois, parfait, un beau cueillage, un beau marbrage, on souffle au pouce, bien dans l'axe, vers le haut, vers le bas, en fonction de ce qu'on souhaite, et là, on a ce qu'on veut, et donc c'est concentration à fond.",143,,0
Entretien 01 25.03.27 01_traitement_A,"En tout cas, moi, au début, peut-être qu'avec l'expérience, on se détend un petit peu, mais c'est un moment où il faut être détendu avec le verre, c'est ce que je pense, il faut être doux, mais pas trop stressé, pas d'à-coups, mais il faut être concentré quand même, en tout cas pour moi.",54,,0
Entretien 01 25.03.27 01_traitement_A,"Je dirais que le verre est tranquillement en train de dormir dans le four, bien au chaud, bien liquide, à un moment donné, il vient de se faire prélever comme ça, donc il n'a un peu rien demandé, il ne va pas se laisser faire tout le long, il va vouloir tomber, c'est pour ça que nous, parce qu'il y a la gravité, donc on va toujours tourner, donc il va vouloir tomber, au moindre geste vers l'avant ou vers l'arrière, il va s'allonger vers l'avant ou venir sur la canne, ensuite il est chaud, donc quand on l'a accueilli, il nous a réchauffé notre canne, donc on va refroidir, ensuite il va, si on ne fait pas un beau marbrage ou un beau maillochage, ou qu'on a fait des à-coups, qu'on a fait des petites facettes, il va bien le garder en lui, il ne va pas nous pardonner, et puis il nous regarde en nous disant vas-y souffle, souffle, et puis on a mal fait, alors c'est l'erreur, on est trop vers le haut, trop vers le bas, on l'a percé, on n'a pas bien compris que là il était vraiment chaud ou trop froid, on n'a pas bien vu, parce que par exemple si je cueille avec une canne très très très chaude, elle va garder beaucoup plus de chaleur, enfin le verre va rester beaucoup plus chaud, au contraire si je cueille avec une canne qui est froide, ça il ne faut pas le faire, mais là déjà très vite mon verre sera froid, ma bulle va être très éloignée du mors, ça va faire des grosses épaisseurs, par exemple si on veut faire un gobelet, donc c'est tous les détails, la chaleur, le verre il connait tout, mais nous il faut essayer de le comprendre.",300,,0
Entretien 01 25.03.27 01_traitement_A,De rien.,2,,0
Entretien 01 25.03.27 02_traitement_A,"Depuis maintenant six mois quelque, c'est ça ?",8,,0
Entretien 01 25.03.27 02_traitement_A,Ça doit être ça.,4,,0
Entretien 01 25.03.27 02_traitement_A,Depuis septembre en fait.,4,,0
Entretien 01 25.03.27 02_traitement_A,"En mars, ça doit faire six mois.",7,,0
Entretien 01 25.03.27 02_traitement_A,"En pâte de verre, c'est ça.",6,,0
Entretien 01 25.03.27 02_traitement_A,C'est un atelier qui s'appelle la fonderie de verre.,9,,0
Entretien 01 25.03.27 02_traitement_A,"C'est un atelier qui fait du coup de la pâte de verre, donc on a beaucoup de four, on travaille surtout à froid.",23,,0
Entretien 01 25.03.27 02_traitement_A,Et voilà.,2,,0
Entretien 01 25.03.27 02_traitement_A,"Alors, en fait, moi j'habite juste à côté de mon atelier, donc déjà j'arrive très rapidement.",16,,0
Entretien 01 25.03.27 02_traitement_A,"J'ai très peu de trajet, c'est assez cool.",8,,0
Entretien 01 25.03.27 02_traitement_A,Donc on commence à neuf heures.,6,,0
Entretien 01 25.03.27 02_traitement_A,"Et donc quand j'arrive, je m'installe.",6,,0
Entretien 01 25.03.27 02_traitement_A,"Assez vite, je reprends souvent ce que j'ai commencé la veille.",11,,0
Entretien 01 25.03.27 02_traitement_A,"Je m'installe souvent dans l'atelier de cire, où du coup, en fait, on travaille avec une technique qui s'appelle la cire perdue.",22,,0
Entretien 01 25.03.27 02_traitement_A,"Donc en fait, on va travailler une cire qu'on va ensuite couler, qu'on va ensuite coffrer dans un plâtre.",19,,0
Entretien 01 25.03.27 02_traitement_A,Et on va faire fondre la cire pour mettre le verre à la place.,14,,0
Entretien 01 25.03.27 02_traitement_A,"Donc c'est ça qu'on appelle la pâte de verre, en fait, et le travail à la cire perdue.",18,,0
Entretien 01 25.03.27 02_traitement_A,Et donc on a beaucoup de cire à retoucher.,9,,0
Entretien 01 25.03.27 02_traitement_A,"En fait, on travaille beaucoup pour des designers, donc on a beaucoup de pièces à retoucher, de cire à retoucher.",20,,0
Entretien 01 25.03.27 02_traitement_A,"Donc le matin, quand j'arrive, souvent je reprends la cire de la veille que je n'avais pas finie.",18,,0
Entretien 01 25.03.27 02_traitement_A,J'attends que mon patron arrive.,5,,0
Entretien 01 25.03.27 02_traitement_A,"Il arrive vers 9h, 9h05, à peu près en même temps que moi, mais des fois, j'arrive avant lui.",19,,0
Entretien 01 25.03.27 02_traitement_A,Il y a un autre employé aussi.,7,,0
Entretien 01 25.03.27 02_traitement_A,"Et du coup, une fois que mon patron est arrivé, souvent il va me dire, pareil, il va s'installer un petit peu et puis vers 9h30, il va me dire un petit peu ce qu'on a à faire dans la journée.",41,,0
Entretien 01 25.03.27 02_traitement_A,"Des fois, je vais préparer du verre pour mettre dans les moules, du coup.",14,,0
Entretien 01 25.03.27 02_traitement_A,"Des fois, je vais retoucher ces cires-là précisément.",8,,0
Entretien 01 25.03.27 02_traitement_A,Je vais pouvoir faire des fois des élastomères.,8,,0
Entretien 01 25.03.27 02_traitement_A,"En fait, c'est un moule qu'on va mettre par-dessus un objet.",11,,0
Entretien 01 25.03.27 02_traitement_A,"Et comme ça, une fois déconstruit, on va pouvoir enlever l'objet.",11,,0
Entretien 01 25.03.27 02_traitement_A,"On aura juste le moule dans lequel on va couler la cire, en fait.",14,,0
Entretien 01 25.03.27 02_traitement_A,"Et puis donc, la plupart du temps, je vais retoucher des cires, par exemple.",14,,0
Entretien 01 25.03.27 02_traitement_A,Donc imaginons que je retouche des cires.,7,,0
Entretien 01 25.03.27 02_traitement_A,"Voilà, je vais faire ça jusqu'à midi, jusqu'à 13h.",9,,0
Entretien 01 25.03.27 02_traitement_A,"À 13h, je vais aller manger, donc juste à côté, c'est nickel, pareil.",13,,0
Entretien 01 25.03.27 02_traitement_A,"Je reviens à 14h et puis pareil, je vais travailler sur mes cires.",13,,0
Entretien 01 25.03.27 02_traitement_A,Je vais pouvoir démouler aussi.,5,,0
Entretien 01 25.03.27 02_traitement_A,"Souvent, l'après-midi, on démoule les objets qu'on a mis dans les fours parce que ça a eu le temps de refroidir.",21,,0
Entretien 01 25.03.27 02_traitement_A,"En fait, quand les fours sont…",6,,0
Entretien 01 25.03.27 02_traitement_A,C'est des cuissons qui durent très très longtemps.,8,,0
Entretien 01 25.03.27 02_traitement_A,"C'est deux, trois semaines, même parfois plus.",7,,0
Entretien 01 25.03.27 02_traitement_A,"Mais souvent, ça va être…",5,,0
Entretien 01 25.03.27 02_traitement_A,Souvent une à deux semaines.,5,,0
Entretien 01 25.03.27 02_traitement_A,Souvent une à deux semaines.,5,,0
Entretien 01 25.03.27 02_traitement_A,"Trois semaines pour les grosses pièces, plus si vraiment c'est des pièces…",12,,0
Entretien 01 25.03.27 02_traitement_A,"Et donc souvent, on éteint les fours qui soient prêts.",10,,0
Entretien 01 25.03.27 02_traitement_A,"On les éteint le matin et comme ça, ça a le temps de refroidir.",14,,0
Entretien 01 25.03.27 02_traitement_A,"Et puis l'après-midi, on va démouler.",6,,0
Entretien 01 25.03.27 02_traitement_A,"Souvent, je fais ça l'après-midi, par exemple, où je prépare du verre.",12,,0
Entretien 01 25.03.27 02_traitement_A,Voilà.,1,,0
Entretien 01 25.03.27 02_traitement_A,"Voilà, c'est ça.",3,,0
Entretien 01 25.03.27 02_traitement_A,"Alors moi, je travaille surtout… Bon, le travail de la pâte de verre, il faut dire que c'est vraiment… C'est assez complexe, pas comme le soufflage.",26,,0
